0x01: 0x04
0x02: 0x01
0x03: 0x00
0x04: 0x80
0x05: 0x10
0x06: 0x00
0x07: 0xE4
0x08: 0xC0
0x09: 0x00
0x0A: 0x41
0x0B: 0x40
0x0C: 0x02
0x0D: 0x92
0x0E: 0xF5
0x0F: 0x20
0x10: 0x24
0x11: 0x9F
0x12: 0x09
0x13: 0x1A
0x14: 0x40
0x15: 0xB0
0x16: 0x7B
0x17: 0x9B
0x18: 0x08
0x19: 0xE0
0x1A: 0xE0
0x1B: 0x40
0x1C: 0x80
0x1D: 0x06
0x1E: 0x10
0x1F: 0x00
0x20: 0x00
0x21: 0x00
0x22: 0x00
0x23: 0x02
0x24: 0xFF
0x25: 0x00
0x26: 0x05
0x27: 0x80
0x28: 0x00
0x29: 0xFF
0x2A: 0x00
0x2B: 0x00
0x2C: 0x00
0x2D: 0x04
0x2E: 0x88
0x2F: 0x2D
0x30: 0xD4
0x31: 0x00
0x32: 0x00
0x33: 0x00
0x34: 0x00
0x35: 0x00
0x36: 0x00
0x37: 0xD0
0x38: 0x40
0x39: 0x00
0x3A: 0x00
0x3B: 0x00
0x3C: 0x8F
0x3D: 0x02
0x3E: 0x00
0x3F: 0x00
0x40: 0x00
0x41: 0x00
0x42: 0x00
0x43: 0x00
0x44: 0x00
0x45: 0x00
0x46: 0x00
0x47: 0x00
0x48: 0x00
0x49: 0x00
0x4A: 0x00
0x4B: 0x00
0x4C: 0x00
0x4D: 0x00
0x4E: 0x01
0x4F: 0x00
0x58: 0x1B
0x5A: 0x55
0x5C: 0x70
0x6F: 0x30
0x71: 0x00